question,A,B,C,D,answer
Who did Putin compare Elon Musk to?,Korolev,Gagarin,Tsiolkovsky,Yeltsin,A
What symbolized socioeconomic status for the Kumars?,Scooter,Car,House,Job,B
What article is allegedly undermined in the National Herald case?,Article 14,Article 32,Article 21,Article 370,A
What tech areas did Modi & Stubb discuss?,Quantum tech,5G only,Cybersecurity,All of above,D
What did the SC extend a stay on?,Hyderabad deforestation,Pune military drills,ATM installation,Gaza buffer zone,A
Where did DUSTLIK-VI exercise begin?,Pune,Delhi,Agra,Jaipur,A
