question,A,B,C,D,answer
What country launched an operation in Bajaur?,Pakistan,USA,China,Israel,A
Which company will be delisted from the Hong Kong Stock Exchange?,Evergrande,Alibaba,Tencent,Huawei,A
Who was issued an arrest warrant in South Korea?,Kim Keon Hee,Yoon Suk Yeol,Lee Sang-min,Park Geun-hye,A
What caused a major protest in New Delhi?,Dog removal,Pollution,Poverty,Corruption,A
Which country recognized Palestine's independence?,Australia,USA,UK,Israel,A
Where did a major ground assault occur?,Dobropillia,Kyiv,Kharkiv,Mariupol,A
