question,A,B,C,D,answer
Why did Russia end its missile moratorium?,US deployment,Budget cuts,Internal conflict,International pressure,A
Who is nominated for ICC Men's T20I Cricketer?,Arshdeep Singh,Sikandar Raza,Travis Head,Babar Azam,A
How many Palestinians were detained after Gaza raid?,240+,100,50,150,A
What's the current value of India-Australia trade?,$26 billion,$15 billion,$30 billion,$20 billion,A
What campaign did PM Modi launch in Mann Ki Baat?,Preamble reading,Constitution debate,Swachh Bharat,Yoga Day,A
How many died in the South Korea airliner crash?,85+,100,50,70,A
