question,A,B,C,D,answer
Who was sentenced for the pork barrel scam?,Napoles,Cagas,Uribe,Boluarte,A
Which country faced a famine declaration?,Gaza,Sudan,Syria,Ukraine,A
Why were Norwegian ski jumpers suspended?,Doping,Tampering,Bribery,Assault,B
Which event caused a mass burial allegation?,Dharmasthala Temple,Abu Talat Beach,Shakahola Forest,Kostiantynivka Market,A
Who resigned from the Dutch cabinet?,Veldkamp,Trump,Zelenskyy,Poilievre,A
Which group was responsible for Cali bombing?,FARC,ISIS,Hamas,Boko Haram,A
