question,A,B,C,D,answer
Who was appointed the new Ukrainian Prime Minister?,Svyrydenko,Shmyhal,Zelenskyy,None,A
Which country lowered its voting age to 16?,UK,US,Canada,France,A
Which militant group was declared a terrorist group by the US?,Lashkar-e-Taiba,Hamas,Hezbollah,Al-Shabaab,A
Where did a deadly stampede occur during a celebration?,Garut,Indonesia,Gaza,Syria,A
Who won the 2025 Wimbledon men's singles title?,Sinner,Alcaraz,Djokovic,Federer,A
Which country's former president was placed under house arrest?,Brazil,South Korea,US,Venezuela,A
