question,A,B,C,D,answer
What was the main topic discussed during Denis Manturov's call with PM Modi?,Trade,Defense,Education,Culture,A
Which country is leading in AI adoption according to BCG?,India,China,USA,Japan,A
What percentage of India's economy is projected to be digital by 2026-27?,10%,20%,30%,40%,B
What is the main focus of the 55th International Film Festival of India?,Indian Cinema,Global Cinema,Documentary Films,Short Films,B
Which constitutional article guarantees the right to a pollution-free environment?,Article 19,Article 21,Article 25,Article 32,B
What is the key objective of the SATRC-25 conference?,Digital Infrastructure,Economic Growth,Climate Change,Cybersecurity,A
