question,A,B,C,D,answer
Who declared a food security emergency in the Philippines?,Laurel,Singh,Volodin,Murmu,A
What event showcased global health innovations in Dubai?,Medlab,IEW,FICCI-FLO,ANA,A
Which country completed Angkor temple restoration?,Cambodia,India,Greece,Philippines,A
What caused school closures in Santorini?,Earthquakes,Floods,Food shortage,Tariffs,A
What percentage did semiconductor revenue increase in 2024?,18%,20%,22%,25%,A
Which organization did Jitendra Singh address?,FICCI-FLO,ANA,NFA,APSARA,A
