question,A,B,C,D,answer
Where did NDA leaders meet?,Nadda's residence,Parliament,Shah's office,Modi's residence,A
What was a key concern at the NDA meeting?,Economic slowdown,Constitutional violations,Foreign policy,Internal security,B
What is PM Modi's vision for Northeast India?,Military base,Tourism hub,Most prosperous region,Industrial center,C
Which hospital was evacuated in Gaza?,Indonesian,Shifa,Al-Shifa,European,A
Who accused Congress of disrespecting Ambedkar?,Modi,Shah,Nadda,Kharge,A
Whose 100th Jayanti was celebrated?,Nehru,Patel,Vajpayee,Gandhi,C
