question,A,B,C,D,answer
PM Modi's Uttarakhand visit focuses on?,Tourism,Defense,Agriculture,Infrastructure,A
Tata Electronics' fab project location?,Gujarat,Maharashtra,Tamil Nadu,Karnataka,A
Jaipur Declaration's core theme?,Circular economy,Trade deals,Climate change,Security,A
US action regarding Ukraine intelligence?,Cut off,Increased,Maintained,Diversified,A
Poonch's dairy sector initiative?,AMCU units,Dairy farms,Milk plants,Pasteurization,A
PMAY Samastipur event involved?,Home funds,Land grants,Job creation,Infrastructure,A
