question,A,B,C,D,answer
Puntland forces captured which ISIS stronghold?,Miraale Valley,Sadow,Baalade,Bari Region,A
What caused the Bryansk train derailment?,Bombing,Bridge collapse,Illegal interference,Mechanical failure,C
What prompted UN staff cuts?,Funding shortfall,Budget surplus,Efficiency drive,Staff resignations,A
Which country's citizens protested euro adoption?,Bulgaria,Greece,Germany,Italy,A
Who became New Zealand's Deputy PM?,Seymour,Peters,Macron,Trump,A
What caused the Seoul subway fire?,Arson,Accident,Bombing,Mechanical failure,A
