question,A,B,C,D,answer
Who represented India at Trump's inauguration?,Jaishankar,Modi,Shah,Bhatia,A
What is PM Modi's vision for India?,Developed nation,Economic growth,Social justice,Technological advancement,A
Who is the new BCCI Secretary?,Saikia,Shah,Bhatia,None,A
What improves infection resistance?,Fibre,Protein,Vitamins,Minerals,A
Trump called CA wildfires what?,Worst catastrophe,Minor incident,Natural disaster,Environmental issue,A
What's the Maha Kumbh's economic impact?,₹4 lakh crore,₹2 lakh crore,₹1 lakh crore,₹5 lakh crore,A
