question,A,B,C,D,answer
Who claimed responsibility for attacks in Burkina Faso?,Al-Qaeda,ISIS,Boko Haram,Taliban,A
Where was a long-lost Magna Carta found?,Oxford,Harvard,British Museum,Vatican,B
What caused the sinking of the superyacht 'Bayesian'?,Fire,Collision,Extreme wind,Engine failure,C
Which country's visa policy changed for some South American nations?,China,USA,Brazil,Argentina,A
Who was executed in Florida?,Glen Rogers,Ted Bundy,Jeffrey Dahmer,John Wayne Gacy,A
Who became the new leader of the Australian Greens?,Waters,Bandt,Ley,Goïta,A
